{
  "schema_version": 1,
  "pillar": "stablecoins",
  "status_seal": "in_force",
  "regulator": "HKMA",
  "instruments": [
    "Stablecoins Ordinance (Cap. 656)"
  ],
  "standing_summary": "The Stablecoins Ordinance has been in force since 1 August 2025, requiring a licence to issue fiat-referenced stablecoins in or pegged to the Hong Kong dollar. Licensees must maintain paid-up share capital of at least HK$25 million, back issued stablecoins with reserve assets at least equal to their par value at all times, and honour redemption requests at par, generally within one business day. Interested applicants were asked to submit applications by 30 September 2025 for early consideration, and on 10 April 2026 HKMA granted the first two licences -- to Anchorpoint Financial Limited and The Hongkong and Shanghai Banking Corporation Limited. As of 28 April 2026, HKMA confirmed neither licensee had yet issued a stablecoin in the market and warned the public about fraudulent tokens falsely trading on their names.",
  "last_changed": "2026-04-28",
  "key_links": [
    {
      "label": "HKMA press release: Granting of stablecoin issuer licences (10 Apr 2026)",
      "url": "https://www.hkma.gov.hk/eng/news-and-media/press-releases/2026/04/20260410-4/"
    },
    {
      "label": "HKMA: Register of Licensees under the Stablecoins Ordinance",
      "url": "https://www.hkma.gov.hk/eng/regulatory-resources/registers/register-of-licensed-stablecoin-issuers/"
    },
    {
      "label": "HKMA Guideline on Supervision of Licensed Stablecoin Issuers (PDF)",
      "url": "https://www.hkma.gov.hk/media/eng/doc/key-functions/ifc/stablecoin-issuers/Guideline_on_supervision_of_licensed_stablecoin_issuers_eng.pdf"
    },
    {
      "label": "HKMA press release: Beware of tokens purported to be associated with licensed stablecoin issuers (28 Apr 2026)",
      "url": "https://www.hkma.gov.hk/eng/news-and-media/press-releases/2026/04/20260428-5/"
    },
    {
      "label": "HKMA press release: Implementation of regulatory regime for stablecoin issuers (29 Jul 2025)",
      "url": "https://www.hkma.gov.hk/eng/news-and-media/press-releases/2025/07/20250729-4/"
    },
    {
      "label": "HKMA Insight: Chief Executive's article on the stablecoin licensing regime (10 Apr 2026)",
      "url": "https://www.hkma.gov.hk/eng/news-and-media/insight/2026/04/20260410/"
    },
    {
      "label": "HKMA/SFC joint statement on stablecoin-related market movements (14 Aug 2025)",
      "url": "https://www.hkma.gov.hk/eng/news-and-media/press-releases/2025/08/20250814-8/"
    }
  ],
  "open_items": [
    "Whether HKMA grants further licences beyond the initial two is unresolved; HKMA has described the eventual total number as likely to remain very limited.",
    "Neither licensee has stated a specific product launch date; both have indicated a general window of mid-to-second-half 2026.",
    "How virtual asset trading platforms may offer these stablecoins for trading is governed by a separate SFC circular (see the Exchanges (VATP) pillar).",
    "A 14 August 2025 joint HKMA/SFC statement titled 'Joint Statement by the HKMA and the SFC on Stablecoin-related Market Movements' predates the regime's first licences (10 Apr 2026); HKMA's press-release page returned no retrievable content on every attempt made on 31 Jul 2026 (the same HKMA-wide access problem logged in the Banking & Money pillar's open_items across several recent updates), so the specific market movements it addresses remain unconfirmed against primary source text and should be checked directly once the site is reachable."
  ],
  "generated_at": "2026-07-31T09:15:00Z",
  "model": "Claude (Anthropic)",
  "status": "unverified"
}
