{
  "schema_version": 1,
  "pillar": "exchanges_vatp",
  "status_seal": "in_force",
  "regulator": "SFC",
  "instruments": [
    "Anti-Money Laundering and Counter-Terrorist Financing Ordinance (Cap. 615)",
    "Securities and Futures Ordinance (Cap. 571)"
  ],
  "standing_summary": "The dual licence arrangement for virtual asset trading platforms (VATPs) -- a Securities and Futures Ordinance licence for platforms trading at least one security token, and an Anti-Money Laundering and Counter-Terrorist Financing Ordinance licence for all centralised VA exchanges -- has been in force since 1 June 2023. As of the SFC's most recently updated public list, 13 platforms are licensed. The SFC's ASPIRe roadmap, published 19 February 2025, continues to drive expansion: staking by licensed platforms has been permitted since 7 April 2025, and a 27 May 2026 circular set out how VATPs may offer HKMA-licensed stablecoins for trading. Two further SFC circulars have since addressed platform cybersecurity: a 2 June 2026 circular directing licensed corporations and SFC-licensed virtual asset service providers, including VATPs, to assess and strengthen their defences against AI-enabled cyberattacks, and a 9 July 2026 circular requiring internet brokers and VATP operators to replace one-time-password client authentication with phishing-resistant methods (e.g. passkeys or bound devices) within 12 months.",
  "last_changed": "2026-07-13",
  "key_links": [
    {
      "label": "SFC: Virtual asset trading platform operators (legal basis)",
      "url": "https://www.sfc.hk/en/Welcome-to-the-Fintech-Contact-Point/Virtual-assets/Virtual-asset-trading-platforms-operators"
    },
    {
      "label": "SFC: List of licensed virtual asset trading platforms",
      "url": "https://www.sfc.hk/en/Welcome-to-the-Fintech-Contact-Point/Virtual-assets/Virtual-asset-trading-platforms-operators/Lists-of-virtual-asset-trading-platforms"
    },
    {
      "label": "SFC press release: ASPIRe roadmap (19 Feb 2025)",
      "url": "https://apps.sfc.hk/edistributionWeb/api/news/list-content?refNo=25PR20&lang=EN"
    },
    {
      "label": "SFC circular: staking guidance for VATPs (7 Apr 2025)",
      "url": "https://apps.sfc.hk/edistributionWeb/api/news/list-content?refNo=25PR47&lang=EN"
    },
    {
      "label": "SFC circular 26EC26: stablecoin services by VATPs (27 May 2026)",
      "url": "https://apps.sfc.hk/edistributionWeb/api/circular/list-content/circular/doc?refNo=26EC26&lang=EN"
    },
    {
      "label": "SFC circular 26EC32: enhanced cybersecurity measures against AI-enabled cyberattacks (2 Jun 2026)",
      "url": "https://apps.sfc.hk/edistributionWeb/api/circular/list-content/circular/doc?refNo=26EC32&lang=EN"
    },
    {
      "label": "SFC circular 26EC35: phishing-resistant authentication for internet brokers and VATPs (9 Jul 2026)",
      "url": "https://apps.sfc.hk/edistributionWeb/api/circular/list-content/circular/doc?refNo=26EC35&lang=EN"
    },
    {
      "label": "HKMA circular: supplemental joint circular on intermediaries' virtual asset-related activities (30 Sep 2025)",
      "url": "https://brdr.hkma.gov.hk/eng/doc-ldg/current/20250930-1-EN"
    }
  ],
  "open_items": [
    "Further ASPIRe workstream initiatives are ongoing and not all have concluded.",
    "Additional platform licensing continues incrementally (e.g. licences granted February and May 2026).",
    "The separate virtual asset dealer, custodian, advisory, and management licensing regimes (a related but distinct pillar) remain at bill-pending stage, not yet in force.",
    "The 9 July 2026 phishing-resistant authentication mandate has a 12-month transition period; full compliance across internet brokers and VATPs is not yet due.",
    "On 30 Jul 2026, while drafting a card for a 30 Sep 2025 HKMA circular described in its own title as a 'Supplemental joint circular on intermediaries' virtual asset-related activities,' HKMA's site (brdr.hkma.gov.hk, www.hkma.gov.hk, and its RSS feeds) was found unreachable -- the same HKMA-wide access problem already logged in the Banking & Money pillar's open_items for 26, 28, and 29 Jul 2026 -- while a control fetch of SFC's site succeeded at the same time. That circular's card was therefore drafted from its official title alone; its substantive content, and specifically which earlier circular it supplements, should be confirmed against primary text once HKMA's site is reachable again."
  ],
  "generated_at": "2026-07-30T09:20:00Z",
  "model": "Claude (Anthropic)",
  "status": "unverified"
}
